{
  "id": "762169",
  "type": "titles",
  "attributes": {
    "name": "\"Great Satan\" Vs. the \"Mad Mullahs\": How the United States and Iran Demonize Each Other",
    "publisherName": "Praeger",
    "isTitleCustom": false,
    "subjects": [
      {
        "type": "BISAC",
        "subject": "SOCIAL SCIENCE / Ethnic Studies / General"
      }
    ],
    "identifiers": [
      {
        "id": "978-0-275-98214-0",
        "type": "ISBN",
        "subtype": "Print"
      },
      {
        "id": "978-1-282-40979-8",
        "type": "ISBN",
        "subtype": "Online"
      },
      {
        "id": "978-0-313-06800-3",
        "type": "ISBN",
        "subtype": "Online"
      }
    ],
    "publicationType": "Book",
    "isPeerReviewed": false,
    "contributors": [
      {
        "type": "author",
        "contributor": "Beeman, William O."
      }
    ]
  },
  "relationships": {
    "resources": {
      "meta": {
        "included": false
      }
    }
  }
}
